{
  "business": {
    "name": "Sample Restaurant",
    "tagline": "Seasonal local dining with a coastal California soul.",
    "description": "A polished preview-safe restaurant demo generated by AFO Restaurant Template v1.",
    "cuisine": "Seasonal American",
    "location": "San Juan Capistrano, CA",
    "phone": "(949) 555-0198",
    "booking_url": "https://sample-restaurant.example/reserve",
    "address": "123 Camino Demo",
    "city": "San Juan Capistrano",
    "region": "CA",
    "hours": [
      { "label": "Monday - Thursday", "value": "4:00 PM - 9:00 PM" },
      { "label": "Friday", "value": "4:00 PM - 10:00 PM" },
      { "label": "Saturday", "value": "10:00 AM - 10:00 PM" },
      { "label": "Sunday", "value": "10:00 AM - 8:00 PM" }
    ]
  },
  "theme": {
    "style_name": "coastal harvest premium",
    "color_palette": {
      "ink": "#1b1713",
      "muted": "#6f6258",
      "paper": "#fff8ed",
      "card": "#ffffff",
      "accent": "#b86b34",
      "accent_dark": "#743f22",
      "sage": "#637d63",
      "gold": "#e5b769"
    },
    "typography": "editorial modern",
    "mood": "warm, refined, local, fresh",
    "hero_variant": "split-card"
  },
  "content": {
    "hero": {
      "eyebrow": "Preview-safe restaurant demo",
      "headline": "A restaurant website that feels ready before it goes live.",
      "body": "Restaurant Template v1 turns structured business data into a beautiful Cloudflare Worker preview with AI-readable discovery routes and AFO guardrails.",
      "primary_cta_label": "View menu",
      "secondary_cta_label": "Explore AI routes"
    },
    "menu_sections": [
      { "title": "Market Favorites", "description": "Seasonal dishes designed for visual menu cards." },
      { "title": "Brunch & Gatherings", "description": "Flexible content blocks for weekend service and private dining." }
    ],
    "menu_items": [
      { "section": "Market Favorites", "name": "Market Garden Toast", "description": "Whipped ricotta, roasted local vegetables, citrus greens, sourdough.", "price": "$14", "tag": "Vegetarian" },
      { "section": "Market Favorites", "name": "Coastal Grain Bowl", "description": "Farro, avocado, pickled onion, grilled squash, lemon-herb vinaigrette.", "price": "$18", "tag": "Fresh" },
      { "section": "Brunch & Gatherings", "name": "Weekend Brunch Plate", "description": "Soft eggs, crispy potatoes, greens, house sourdough, seasonal jam.", "price": "$19", "tag": "Brunch" },
      { "section": "Brunch & Gatherings", "name": "Private Dining Sampler", "description": "A sample event menu block for validating catering and group dining content.", "price": "Preview", "tag": "Events" }
    ],
    "featured_items": ["Market Garden Toast", "Coastal Grain Bowl"],
    "hours": [
      { "label": "Monday - Thursday", "value": "4:00 PM - 9:00 PM" },
      { "label": "Friday", "value": "4:00 PM - 10:00 PM" },
      { "label": "Saturday", "value": "10:00 AM - 10:00 PM" },
      { "label": "Sunday", "value": "10:00 AM - 8:00 PM" }
    ],
    "faqs": [
      { "question": "Is this a live restaurant website?", "answer": "No. This is a preview-safe demo generated from Restaurant Template v1." },
      { "question": "Can this be deployed to production?", "answer": "Not in this workflow. Production routes and custom domains remain blocked until a separate guarded process is explicitly approved." },
      { "question": "What makes this AFO-ready?", "answer": "The Worker includes smoke-testable routes, structured schema, llms.txt, robots.txt, sitemap.xml, and a clear preview-only receipt trail." }
    ],
    "calls_to_action": [
      { "label": "Reserve a preview table", "url": "https://sample-restaurant.example/reserve" },
      { "label": "Call the restaurant", "url": "tel:+19495550198" }
    ],
    "route_panel": [
      { "path": "/", "label": "Homepage", "type": "text/html" },
      { "path": "/health", "label": "Health check", "type": "application/json" },
      { "path": "/llms.txt", "label": "AI instructions", "type": "text/plain" },
      { "path": "/robots.txt", "label": "Crawler policy", "type": "text/plain" },
      { "path": "/sitemap.xml", "label": "Sitemap", "type": "application/xml" },
      { "path": "/schema.json", "label": "Schema JSON-LD", "type": "application/json" }
    ],
    "proof_points": [
      { "value": "6", "label": "Smoke-test routes" },
      { "value": "0", "label": "Production routes" },
      { "value": "100%", "label": "Preview-safe" }
    ]
  },
  "discovery": {
    "base_url": "https://sample-restaurant.example",
    "preview_url": "https://sample-restaurant-afo.jaredtechfit.workers.dev/",
    "llms_txt": "",
    "robots_txt": "",
    "sitemap_xml": "",
    "schema_jsonld": {}
  },
  "routes": ["/", "/health", "/llms.txt", "/robots.txt", "/sitemap.xml", "/schema.json"]
}
